{
  "schema": "skiller-plan.v1",
  "operation": "plan",
  "dry_run": true,
  "inputs": {
    "manifest_path": "<FIXTURES>/manifests/our-manifest.toml",
    "home": "/skiller/golden/home",
    "namespace": "acme",
    "on_conflict": "block"
  },
  "sources": [
    {
      "id": "source-001",
      "source_kind": "file",
      "original_spec": "../sources/acme-handbook",
      "canonical_uri": "file://<FIXTURES>/sources/acme-handbook",
      "source_key": "file:<redacted>",
      "source_status": "refreshed",
      "local_cache_path": "<FIXTURES>/sources/acme-handbook",
      "source_realpath": "<FIXTURES>/sources/acme-handbook",
      "source_digest": "sha256:4b9bf9b812bae7f466143fbfdbd48cc92a4b81a7433f72f9394d83a2c1f04bff",
      "frontmatter_name": "acme-handbook",
      "description": "Read Acme workspace handbook and support records."
    }
  ],
  "actions": [
    {
      "id": "act-7a55cd83560a0602",
      "action": "install-link",
      "status": "dry-run",
      "skill": {
        "canonical_id": "acme:handbook",
        "namespace": "acme",
        "name": "handbook",
        "install_slug": "acme-handbook",
        "frontmatter_name": "acme-handbook",
        "description": "Read Acme workspace handbook and support records.",
        "requested_targets": [
          "claude-code"
        ]
      },
      "source_id": "source-001",
      "target": {
        "id": "claude-code",
        "kind": "proprietary",
        "scope": "host",
        "root": "/skiller/golden/home/.claude/skills",
        "path": "/skiller/golden/home/.claude/skills/acme-handbook",
        "readers": [
          "claude-code"
        ],
        "requested_targets": [
          "claude-code"
        ],
        "lock_id": "target:3726358a2c1fffef"
      },
      "mode": {
        "requested": "link",
        "effective": "link",
        "fallback_possible": true
      },
      "ownership": {
        "class": "absent",
        "path": "/skiller/golden/home/.claude/skills/acme-handbook"
      },
      "planned_writes": [
        {
          "kind": "link",
          "path": "/skiller/golden/home/.claude/skills/acme-handbook"
        }
      ]
    },
    {
      "id": "act-e9a62a46ea4a92f1",
      "action": "install-link",
      "status": "dry-run",
      "skill": {
        "canonical_id": "acme:handbook",
        "namespace": "acme",
        "name": "handbook",
        "install_slug": "acme-handbook",
        "frontmatter_name": "acme-handbook",
        "description": "Read Acme workspace handbook and support records.",
        "requested_targets": [
          "codex"
        ]
      },
      "source_id": "source-001",
      "target": {
        "id": "agents",
        "kind": "shared",
        "scope": "host",
        "root": "/skiller/golden/home/.agents/skills",
        "path": "/skiller/golden/home/.agents/skills/acme-handbook",
        "readers": [
          "codex"
        ],
        "requested_targets": [
          "codex"
        ],
        "lock_id": "target:4ca5b174bd530c5a"
      },
      "mode": {
        "requested": "link",
        "effective": "link",
        "fallback_possible": true
      },
      "ownership": {
        "class": "absent",
        "path": "/skiller/golden/home/.agents/skills/acme-handbook"
      },
      "planned_writes": [
        {
          "kind": "link",
          "path": "/skiller/golden/home/.agents/skills/acme-handbook"
        }
      ]
    }
  ]
}
