{
  "schema": "skiller-plan.v1",
  "operation": "plan",
  "dry_run": true,
  "inputs": {
    "manifest_path": "<FIXTURES>/manifests/our-self.toml",
    "home": "/skiller/golden/home",
    "namespace": "fluxinc",
    "on_conflict": "block"
  },
  "sources": [
    {
      "id": "source-001",
      "source_kind": "file",
      "original_spec": "../sources/our",
      "canonical_uri": "file://<FIXTURES>/sources/our",
      "source_key": "file:<redacted>",
      "source_status": "refreshed",
      "local_cache_path": "<FIXTURES>/sources/our",
      "source_realpath": "<FIXTURES>/sources/our",
      "source_digest": "sha256:5e5520faae5d781da329aa6b6f3a9aa8328ebdabffcc91f79394256d7c1958bc",
      "frontmatter_name": "our",
      "description": "Operate inside an Our AI umbrella workspace."
    }
  ],
  "actions": [
    {
      "id": "act-8102386795ee170a",
      "action": "install-link",
      "status": "dry-run",
      "skill": {
        "canonical_id": "fluxinc:our",
        "namespace": "fluxinc",
        "name": "our",
        "install_slug": "our",
        "frontmatter_name": "our",
        "description": "Operate inside an Our AI umbrella workspace.",
        "requested_targets": [
          "claude-code"
        ]
      },
      "source_id": "source-001",
      "target": {
        "id": "claude-code",
        "kind": "proprietary",
        "scope": "host",
        "root": "/skiller/golden/home/.claude/skills",
        "path": "/skiller/golden/home/.claude/skills/our",
        "readers": [
          "claude-code"
        ],
        "requested_targets": [
          "claude-code"
        ],
        "lock_id": "target:3726358a2c1fffef"
      },
      "mode": {
        "requested": "link",
        "effective": "link",
        "fallback_possible": true
      },
      "ownership": {
        "class": "absent",
        "path": "/skiller/golden/home/.claude/skills/our"
      },
      "planned_writes": [
        {
          "kind": "link",
          "path": "/skiller/golden/home/.claude/skills/our"
        }
      ]
    },
    {
      "id": "act-f3e44e045a9e8226",
      "action": "install-link",
      "status": "dry-run",
      "skill": {
        "canonical_id": "fluxinc:our",
        "namespace": "fluxinc",
        "name": "our",
        "install_slug": "our",
        "frontmatter_name": "our",
        "description": "Operate inside an Our AI umbrella workspace.",
        "requested_targets": [
          "codex"
        ]
      },
      "source_id": "source-001",
      "target": {
        "id": "agents",
        "kind": "shared",
        "scope": "host",
        "root": "/skiller/golden/home/.agents/skills",
        "path": "/skiller/golden/home/.agents/skills/our",
        "readers": [
          "codex"
        ],
        "requested_targets": [
          "codex"
        ],
        "lock_id": "target:4ca5b174bd530c5a"
      },
      "mode": {
        "requested": "link",
        "effective": "link",
        "fallback_possible": true
      },
      "ownership": {
        "class": "absent",
        "path": "/skiller/golden/home/.agents/skills/our"
      },
      "planned_writes": [
        {
          "kind": "link",
          "path": "/skiller/golden/home/.agents/skills/our"
        }
      ]
    }
  ]
}
