{
  "schema": "skiller-plan.v1",
  "operation": "plan",
  "dry_run": true,
  "inputs": {
    "manifest_path": "<FIXTURES>/manifests/clawdapus.toml",
    "home": "/skiller/golden/home",
    "namespace": "mostlydev",
    "on_conflict": "block"
  },
  "sources": [
    {
      "id": "source-001",
      "source_kind": "file",
      "original_spec": "../sources/clawdapus",
      "canonical_uri": "file://<FIXTURES>/sources/clawdapus",
      "source_key": "file:<redacted>",
      "source_status": "refreshed",
      "local_cache_path": "<FIXTURES>/sources/clawdapus",
      "source_realpath": "<FIXTURES>/sources/clawdapus",
      "source_digest": "sha256:4ed5e1d1d06449aa5ccc1e85c6b346753eabc1adbbc34acbb56804947f6f1db1",
      "frontmatter_name": "clawdapus-cli",
      "description": "Operate Clawdapus agents, Clawfiles, and runtime skill dirs."
    }
  ],
  "actions": [
    {
      "id": "act-1d0721cf7bbe6c96",
      "action": "install-copy",
      "status": "dry-run",
      "skill": {
        "canonical_id": "mostlydev:clawdapus-cli",
        "namespace": "mostlydev",
        "name": "clawdapus-cli",
        "install_slug": "clawdapus-cli",
        "frontmatter_name": "clawdapus-cli",
        "description": "Operate Clawdapus agents, Clawfiles, and runtime skill dirs.",
        "requested_targets": [
          "agents"
        ]
      },
      "source_id": "source-001",
      "target": {
        "id": "agents",
        "kind": "shared",
        "scope": "host",
        "root": "/skiller/golden/home/.agents/skills",
        "path": "/skiller/golden/home/.agents/skills/clawdapus-cli",
        "readers": [
          "codex",
          "antigravity",
          "grok",
          "opencode"
        ],
        "requested_targets": [
          "agents"
        ],
        "lock_id": "target:4ca5b174bd530c5a"
      },
      "mode": {
        "requested": "copy",
        "effective": "copy"
      },
      "ownership": {
        "class": "absent",
        "path": "/skiller/golden/home/.agents/skills/clawdapus-cli"
      },
      "planned_writes": [
        {
          "kind": "copy",
          "path": "/skiller/golden/home/.agents/skills/clawdapus-cli"
        },
        {
          "kind": "marker",
          "path": "/skiller/golden/home/.agents/skills/clawdapus-cli/.skiller-install.json"
        }
      ]
    },
    {
      "id": "act-d2382a409880e4c5",
      "action": "install-copy",
      "status": "dry-run",
      "skill": {
        "canonical_id": "mostlydev:clawdapus-cli",
        "namespace": "mostlydev",
        "name": "clawdapus-cli",
        "install_slug": "clawdapus-cli",
        "frontmatter_name": "clawdapus-cli",
        "description": "Operate Clawdapus agents, Clawfiles, and runtime skill dirs.",
        "requested_targets": [
          "claude-code"
        ]
      },
      "source_id": "source-001",
      "target": {
        "id": "claude-code",
        "kind": "proprietary",
        "scope": "host",
        "root": "/skiller/golden/home/.claude/skills",
        "path": "/skiller/golden/home/.claude/skills/clawdapus-cli",
        "readers": [
          "claude-code"
        ],
        "requested_targets": [
          "claude-code"
        ],
        "lock_id": "target:3726358a2c1fffef"
      },
      "mode": {
        "requested": "copy",
        "effective": "copy"
      },
      "ownership": {
        "class": "absent",
        "path": "/skiller/golden/home/.claude/skills/clawdapus-cli"
      },
      "planned_writes": [
        {
          "kind": "copy",
          "path": "/skiller/golden/home/.claude/skills/clawdapus-cli"
        },
        {
          "kind": "marker",
          "path": "/skiller/golden/home/.claude/skills/clawdapus-cli/.skiller-install.json"
        }
      ]
    }
  ]
}
